{
  "template_id":"r4-energy-audit","report_type":"R4","version":"1.0.0","name":"能源审计报告","status":"DRAFT","description":"形成能源消费、系统诊断、节能机会与经济性分析草稿。",
  "applicable_documents":["能源账单和计量数据","建筑或工厂能源审计材料","节能诊断数据"],"inapplicable_documents":["无审计对象、审计期或任何能源活动数据的材料"],
  "fields":[
    {"id":"audit_subject","label":"审计对象名称","type":"string","required":true,"blocking":true,"unit":null,"source_types":["DOCUMENT","USER_INPUT"],"validation":{},"formula_id":null},
    {"id":"facility_type","label":"建筑/设施类型","type":"string","required":true,"blocking":true,"unit":null,"source_types":["DOCUMENT","USER_INPUT"],"validation":{},"formula_id":null},
    {"id":"floor_area","label":"建筑面积","type":"number","required":true,"blocking":true,"unit":"m2","source_types":["DOCUMENT","USER_INPUT"],"validation":{"exclusive_minimum":0},"formula_id":null},
    {"id":"audit_period","label":"审计期","type":"date_range","required":true,"blocking":true,"unit":null,"source_types":["DOCUMENT","USER_INPUT"],"validation":{},"formula_id":null},
    {"id":"baseline_period","label":"基准期","type":"date_range","required":false,"blocking":false,"unit":null,"source_types":["DOCUMENT","USER_INPUT"],"validation":{},"formula_id":null},
    {"id":"audit_level","label":"审计等级","type":"enum","required":true,"blocking":false,"unit":null,"source_types":["DOCUMENT","USER_INPUT"],"validation":{"enum":["L1","L2","L3","其他"]},"formula_id":null},
    {"id":"electricity_consumption","label":"审计期用电量","type":"number","required":true,"blocking":false,"unit":"kWh","source_types":["DOCUMENT","CALCULATION"],"validation":{"minimum":0},"formula_id":null},
    {"id":"gas_consumption","label":"审计期用气量","type":"number","required":false,"blocking":false,"unit":"Nm3","source_types":["DOCUMENT","CALCULATION"],"validation":{"minimum":0},"formula_id":null},
    {"id":"comprehensive_energy","label":"综合能耗","type":"number","required":true,"blocking":false,"unit":"tce","source_types":["CALCULATION"],"validation":{"minimum":0},"formula_id":"R4_COMPREHENSIVE_ENERGY"},
    {"id":"energy_intensity","label":"单位面积能耗","type":"number","required":true,"blocking":false,"unit":"kgce/m2","source_types":["CALCULATION"],"validation":{"minimum":0},"formula_id":"R4_ENERGY_INTENSITY"},
    {"id":"power_factor","label":"功率因数","type":"number","required":false,"blocking":false,"unit":null,"source_types":["DOCUMENT"],"validation":{"minimum":0,"maximum":1},"formula_id":null},
    {"id":"system_breakdown","label":"分系统能耗","type":"array","required":true,"blocking":false,"unit":"kWh","source_types":["DOCUMENT","CALCULATION"],"validation":{"min_items":1},"formula_id":null},
    {"id":"energy_measures","label":"节能措施","type":"array","required":false,"blocking":false,"unit":null,"source_types":["DOCUMENT","USER_INPUT"],"validation":{},"formula_id":null},
    {"id":"estimated_savings","label":"预计节能量","type":"number","required":true,"blocking":false,"unit":"kWh/year","source_types":["DOCUMENT","CALCULATION"],"validation":{"minimum":0},"formula_id":null},
    {"id":"estimated_savings_rate","label":"预计节能率","type":"number","required":true,"blocking":false,"unit":"%","source_types":["CALCULATION"],"validation":{"minimum":0,"maximum":100},"formula_id":"R4_SAVINGS_RATE"},
    {"id":"estimated_investment","label":"预计投资额","type":"number","required":true,"blocking":false,"unit":"CNY","source_types":["DOCUMENT","USER_INPUT"],"validation":{"minimum":0},"formula_id":null},
    {"id":"annual_cost_savings","label":"预计年度成本节省","type":"number","required":true,"blocking":false,"unit":"CNY/year","source_types":["DOCUMENT","CALCULATION"],"validation":{"minimum":0},"formula_id":null},
    {"id":"payback_period","label":"投资回收期","type":"number","required":true,"blocking":false,"unit":"year","source_types":["CALCULATION"],"validation":{"minimum":0},"formula_id":"R4_SIMPLE_PAYBACK"},
    {"id":"auditor_identity","label":"审计人员/机构","type":"string","required":true,"blocking":false,"unit":null,"source_types":["DOCUMENT","USER_INPUT"],"validation":{},"formula_id":null}
  ],
  "sections":[
    {"id":"audit_summary","title":"审计摘要","required":true,"field_ids":["audit_subject","audit_period","comprehensive_energy","estimated_savings_rate"],"allowed_blocks":["paragraph","metric_cards"]},
    {"id":"subject_and_method","title":"审计对象与方法","required":true,"field_ids":["facility_type","floor_area","audit_level","baseline_period"],"allowed_blocks":["paragraph","table"]},
    {"id":"energy_baseline","title":"能源消费与基线","required":true,"field_ids":["electricity_consumption","gas_consumption","comprehensive_energy","energy_intensity","power_factor"],"allowed_blocks":["table","bar_chart","paragraph"]},
    {"id":"system_diagnosis","title":"分系统诊断","required":true,"field_ids":["system_breakdown"],"allowed_blocks":["table","donut_chart","paragraph"]},
    {"id":"measures_and_economics","title":"节能措施与经济性","required":true,"field_ids":["energy_measures","estimated_savings","estimated_savings_rate","estimated_investment","annual_cost_savings","payback_period"],"allowed_blocks":["table","bar_chart","paragraph"]},
    {"id":"audit_limitations","title":"审计人员与限制","required":true,"field_ids":["auditor_identity"],"allowed_blocks":["paragraph","signature_block","callout"]}
  ],
  "calculations":[
    {"formula_id":"R4_COMPREHENSIVE_ENERGY","version":"1","output_field_id":"comprehensive_energy","input_field_ids":["electricity_consumption","gas_consumption"],"parameter_ids":["electricity_tce_factor","gas_tce_factor"],"description":"按冻结的折标系数换算综合能耗。","operator":"WEIGHTED_SUM"},
    {"formula_id":"R4_ENERGY_INTENSITY","version":"1","output_field_id":"energy_intensity","input_field_ids":["comprehensive_energy","floor_area"],"description":"综合能耗除以建筑面积并换算单位。","operator":"SCALED_DIVIDE","scale":1000},
    {"formula_id":"R4_SAVINGS_RATE","version":"1","output_field_id":"estimated_savings_rate","input_field_ids":["estimated_savings","electricity_consumption"],"description":"预计节能量占基准能源消费量的比例。","operator":"PERCENT"},
    {"formula_id":"R4_SIMPLE_PAYBACK","version":"1","output_field_id":"payback_period","input_field_ids":["estimated_investment","annual_cost_savings"],"description":"投资额除以年度成本节省。","operator":"DIVIDE"}
  ],
  "disclaimers":["报告草稿不能替代现场审计、计量复核和注册专业人员签署。"],"render_profile":"r4-form-audit"
}
